development_projects_1,development_projects_2,status,current_appropriation,total_appropriation,expenditures_continuing_2011,expenditures_current_2012,expenditures_total,total_balance
Housing and Community Development,Community Development (schedule I),-,15141107,15141107,-,3353483.1,3353483.1,11787623.9
Housing and Community Development,Barangay Development Fund (schedule II),-,16290160.96,19055019.98,284000,4969442.98,5253442.98,11320718
Social Development,LGU Counterpart to the Regional Drug Rehabilitation and Treatment Center for Drug Dependent,-,242000,242000,-,-,-,242000
Economic Development,Assistance to Cooperatives (capital build-up),-,200000,200000,-,-,-,200000
Economic Development,Repair or Rehabilitation Projects (schedule III),-,8079094.5,10001619,-,1969995.2,1969995.2,6109099.3
Economic Development,Repair or Maintenance of Street Lights,-,7369220.02,7369220.02,-,-,-,7369220.02
Economic Development,Amortization of Development Project Loans,-,7601925,10135900,-,2533975,2533975,5067950
Grand Total,Grand Total,-,54923507.5,62144866,284000,12826896.28,13110896.28,42096611.22
